{
  "id": "geolibre-netcdf",
  "name": "NetCDF Loader",
  "version": "0.5.7",
  "entry": "index.js",
  "style": "style.css",
  "description": "Load NetCDF4/HDF5 climate grids into GeoLibre as color-mapped raster layers.",
  "author": "Husayn El Sharif",
  "homepage": "https://github.com/helsharif/geolibre-netcdf-loader-plugin"
}
