{
  "id": "geolibre-sample-plugin",
  "name": "Sample Plugin",
  "version": "1.2.0",
  "description": "An example plugin that adds a map control and demonstrates the plugin UI surface APIs: a shared-rail right-sidebar panel (dock: replace-style), a top toolbar menu, and a floating panel.",
  "entry": "index.js",
  "style": "style.css"
}
